phase_id,phase_name,status,current_owner,input_needed,source_files,output_files,blockers,next_action,last_updated
0,Repo hygiene and publication boundary,done,Codex,None,.gitignore; docs/GIT_PUBLICATION_AUDIT.md,AGENTS.md; docs/project-memory/PUBLICATION_BOUNDARY.md,None,Prepare first public-safe commit,2026-06-06
1,Public TikTok dataset model,done,Codex,None,public-data/tiktok; scripts/export-public-tiktok.py; scripts/check-public-export-policy.py; docs/schemas/PUBLIC_JSONL_SCHEMA.md,public source records passages creators and insight cards,Generated export not committed,Keep export reproducible and uncommitted,2026-06-07
2,Transcript polish pipeline,in_progress,Codex,ASR smoke test and new-source intake automation,docs/research/TRANSCRIPTION_PIPELINE_OPTIONS.md; docs/research/LOCAL_WORKER_AUTOMATION_ARCHITECTURE.md; docs/research/LOCAL_LLM_CLEANUP_LAYER.md; docs/research/CREATOR_ADMIN_FLOW.md; docs/project-memory/TIKTOK_DISCOVERY_2026_06_08.md; docs/project-memory/NEW_CREATOR_INTAKE_RUNBOOK.md; docs/project-memory/TIKTOK_INTAKE_EXECUTION_PLAN.md; docs/project-memory/GPT_PRO_REVIEW_RUNBOOK.md; config/tiktok-intake-queue.20260608.json; scripts/tiktok-ytdlp-metadata-extract.py; scripts/import-tiktok-staging-to-kb.py; scripts/hermes-tiktok-refresh.ps1; scripts/base2026-worker.py; scripts/base2026-claim-extract-local.py; scripts/base2026-evidence-verify.py; scripts/base2026-import-claim-candidates.py; scripts/base2026-build-chatgpt-review-packet.py; scripts/base2026-apply-chatgpt-review.py; scripts/base2026-review-insight-candidates.py; scripts/base2026-promote-insight-candidates.py,GPT/Codex source-only backfill processed all sources with passages and no cards; targeted hydration repaired tiktok-video-7648365806375488782; local export is 957 source records 1396 passages 1692 insight cards 1228 public insight cards 1586 topics; backfill queue is 0; 45 reviewed-no-card sources are tracked in ignored .planning registry,two older no-audio @tjrobertson52 records remain needs_source_review,Continue check-only intake: captions/ASR decision -> import dry-run -> evidence verification -> reviewed promotion gate,2026-06-11
3,Meilisearch index and search API,done,Codex,None,public-data/tiktok; scripts/meili-index-public.py,base2026_public_tiktok,None,Reindex only when data changes,2026-06-06
4,Public web UI,done,Codex,None,web/static; scripts/generate-public-pages.py; docs/project-memory/PUBLIC_INTELLIGENCE_IMPLEMENTATION_PLAN_2026_06_08.md,/knowledge/ search UI plus generated creator/source/topic/compare pages; canonical source identity row; compact topic evidence hero; icon-only share controls; compact meta chips; compact roadmap status marks; topic chips; excerpt-only source dialog; no raw claims in public source/passages JSON,None,Next UI/product layer is separate multi-index tabs and reviewed insight queue,2026-06-11
5,Deploy and VPS runbook,done,Codex,None,scripts/package-public-release.ps1; scripts/meili-index-public.py; scripts/deploy-public-vps.ps1; scripts/generate-base2026-sitemap.py; scripts/server-patch-nginx-base2026.py,/var/www/base2026-knowledge/releases/base2026-roadmap-status-ay44-20260611,"Release deployed; nginx active; current symlink points to ay44; public export has 957 sources, 1396 passages, 1692 insight cards, 1228 public insight cards; canonical source identity/share/meta UI live; compact topic evidence hero live; compact roadmap status marks live; static assets gzip/cache optimized; sitemap index live; robots.txt references Base2026 sitemap",Use repeatable deploy script and gzip/static cache check for future releases; keep generated/private artifacts out of commits,2026-06-11
6,Hermes local prototype,done,Hermes/Codex,None,docs/project-memory/HERMES_RUNBOOK.md; scripts/hermes-tiktok-refresh.ps1; scripts/run-hermes-polish-worker.ps1; scripts/register-hermes-webui-task.ps1,Hermes WebUI task repaired for private/local prototype use,Not production dependency,Use only locally until production transcription pipeline is selected,2026-06-07
7,Open-source packaging,done,Codex,None,README.md; CONTRIBUTING.md; CODE_OF_CONDUCT.md; SECURITY.md; .github/workflows/ci.yml; .github/workflows/scorecard.yml; .github/ISSUE_TEMPLATE; .github/dependabot.yml; docs; scripts/deploy-public-vps.ps1,Public GitHub repository https://github.com/offflinerpsy/base2026 with default branch main; open-source docs repeatable deploy script GitHub metadata staging/preflight helpers Apache-2.0 LICENSE,None,Keep generated/private artifacts out of future commits and rerun publication audit before each push,2026-06-10
8,Security and compliance audit,done,Reviewer,None,docs/PUBLICATION_AUDIT_REPORT_2026_06_08.md; docs/GIT_PUBLICATION_AUDIT.md; docs/PUBLICATION_STAGING_PLAN.md; docs/research/PUBLIC_CONTENT_RISK_MODEL.md; scripts/check-public-export-policy.py; scripts/audit-publication-boundary.py,Publication boundary audit and GitHub metadata validation passed before public GitHub push; public export policy remains excerpt-only with no full transcripts; new backfill candidates remain private/pending,None,Rerun audit before every future staging/push,2026-06-10
